[
  {
    "id": "bombas.positioning.reddit_frame_buy_it_for_life",
    "brand": "bombas",
    "section": "positioning",
    "field": "frame",
    "value": {
      "frame": "buy_it_for_life",
      "mentions": 9,
      "mentions_brand": 0
    },
    "text": "Reddit frame 'buy it for life' appears in 9 posts or comments.",
    "source": {
      "type": "review",
      "ref": "apify:trudax~reddit-scraper-lite:WTsLmYvpEQdVGS7Kv:https://www.reddit.com/r/BuyItForLife/comments/1qsw2pl/my_first_bifl_outfit/",
      "captured_at": "2026-09-28"
    },
    "tier": "evidence",
    "visibility": "public",
    "notes": "reddit language, not for testimonial use",
    "confidence": 0.5
  },
  {
    "id": "bombas.positioning.reddit_frame_worth_the_price",
    "brand": "bombas",
    "section": "positioning",
    "field": "frame",
    "value": {
      "frame": "worth_the_price",
      "mentions": 2,
      "mentions_brand": 0
    },
    "text": "Reddit frame 'worth the price' appears in 2 posts or comments.",
    "source": {
      "type": "review",
      "ref": "apify:trudax~reddit-scraper-lite:WTsLmYvpEQdVGS7Kv:https://www.reddit.com/r/malefashionadvice/comments/1otoofp/comment/no614lh/",
      "captured_at": "2026-09-28"
    },
    "tier": "evidence",
    "visibility": "public",
    "notes": "reddit language, not for testimonial use",
    "confidence": 0.5
  },
  {
    "id": "bombas.positioning.reddit_frame_marketing_brand",
    "brand": "bombas",
    "section": "positioning",
    "field": "frame",
    "value": {
      "frame": "marketing_brand",
      "mentions": 3,
      "mentions_brand": 0
    },
    "text": "Reddit frame 'marketing brand' appears in 3 posts or comments.",
    "source": {
      "type": "review",
      "ref": "apify:trudax~reddit-scraper-lite:WTsLmYvpEQdVGS7Kv:https://www.reddit.com/r/BuyItForLife/comments/1s94inc/fully_convinced_darn_tough_has_a_crazy_marketing/",
      "captured_at": "2026-09-28"
    },
    "tier": "evidence",
    "visibility": "public",
    "notes": "reddit language, not for testimonial use",
    "confidence": 0.5
  },
  {
    "id": "bombas.positioning.reddit_frame_mission_giving",
    "brand": "bombas",
    "section": "positioning",
    "field": "frame",
    "value": {
      "frame": "mission_giving",
      "mentions": 1,
      "mentions_brand": 0
    },
    "text": "Reddit frame 'mission giving' appears in 1 posts or comments.",
    "source": {
      "type": "review",
      "ref": "apify:trudax~reddit-scraper-lite:WTsLmYvpEQdVGS7Kv:https://www.reddit.com/r/femalefashionadvice/comments/1po5z34/comment/nueiofl/",
      "captured_at": "2026-09-28"
    },
    "tier": "evidence",
    "visibility": "public",
    "notes": "reddit language, not for testimonial use",
    "confidence": 0.5
  },
  {
    "id": "bombas.positioning.frame",
    "brand": "bombas",
    "section": "positioning",
    "field": "frame",
    "value": "comfort you notice, with a pair given for every pair bought",
    "text": "Bombas sells everyday comfort you can feel on the first wear, and every purchase gives one pair to someone in a shelter. Comfort is the reason to buy; giving is the reason to feel good about paying more.",
    "source": {
      "type": "agent",
      "ref": "synthesis from merged brain records, 28 Sep 2026",
      "captured_at": "2026-09-28",
      "derived_from": [
        "bombas.claims.brand_positioning",
        "bombas.identity.giving_model",
        "bombas.objection_ladders.comfort_and_feel"
      ]
    },
    "confidence": 0.8,
    "tier": "inferred",
    "status": "active",
    "visibility": "public",
    "added_by": "claude"
  },
  {
    "id": "bombas.positioning.category_frame",
    "brand": "bombas",
    "section": "positioning",
    "field": "category_frame",
    "value": "premium everyday basics, socks first",
    "text": "Premium everyday basics. Socks and slippers are 93 percent of revenue; underwear and t-shirts are the growth line. The category frame is comfort basics, not performance gear and not fashion.",
    "source": {
      "type": "agent",
      "ref": "synthesis from merged brain records, 28 Sep 2026",
      "captured_at": "2026-09-28",
      "derived_from": [
        "bombas.economics.category_revenue_mix_2023",
        "bombas.products"
      ]
    },
    "confidence": 0.8,
    "tier": "inferred",
    "status": "active",
    "visibility": "public",
    "added_by": "claude"
  },
  {
    "id": "bombas.positioning.price_frame",
    "brand": "bombas",
    "section": "positioning",
    "field": "price_frame",
    "value": "worth more than a multi-pack because it lasts and feels better",
    "text": "The price objection is the largest one in reviews: 56 complaint quotes ask whether a pair is worth more than ordinary socks, most of them on Amazon. The price story has to be feel and wear life against a 6-pack from a mass retailer, with the donated pair as the tie-breaker, not the headline.",
    "source": {
      "type": "agent",
      "ref": "synthesis from merged brain records, 28 Sep 2026",
      "captured_at": "2026-09-28",
      "derived_from": [
        "bombas.objection_ladders.price_and_value",
        "bombas.avatars"
      ]
    },
    "confidence": 0.75,
    "tier": "inferred",
    "status": "active",
    "visibility": "private",
    "added_by": "claude"
  },
  {
    "id": "bombas.positioning.competitive_frame",
    "brand": "bombas",
    "section": "positioning",
    "field": "competitive_frame",
    "value": {
      "direct": [
        "Stance",
        "Darn Tough Vermont",
        "Smartwool",
        "Feetures",
        "Comrad Socks"
      ],
      "basics_apparel": [
        "Mack Weldon",
        "Tommy John",
        "MeUndies",
        "Allbirds",
        "Everlane",
        "Vuori",
        "Quince"
      ],
      "reddit_recommended_instead": [
        "Darn Tough",
        "Uniqlo",
        "Stance",
        "Kirkland"
      ]
    },
    "text": "Two competitor sets. Direct: sock brands with a technical or durability story, led by Darn Tough, which Reddit recommends instead of Bombas 4 times on a lifetime guarantee. Adjacent: comfort basics apparel brands that compete for the same gift and everyday-basics wallet. Kirkland and Uniqlo are the value anchors buyers compare against.",
    "source": {
      "type": "agent",
      "ref": "synthesis from merged brain records, 28 Sep 2026",
      "captured_at": "2026-09-28",
      "derived_from": [
        "bombas.competitors.competitor_frame",
        "bombas.competitors.reddit_recommended_darn_tough"
      ]
    },
    "confidence": 0.8,
    "tier": "inferred",
    "status": "active",
    "visibility": "private",
    "added_by": "claude"
  },
  {
    "id": "bombas.positioning.proof_points",
    "brand": "bombas",
    "section": "positioning",
    "field": "proof_points",
    "value": [
      "one pair donated per pair bought, over 150 million items",
      "Happiness Guarantee: replace or exchange if a pair fails",
      "Honeycomb arch support, seamless toe, blister tab",
      "B Corp certified"
    ],
    "text": "Four proof points carry the positioning: the giving count, the guarantee, the construction details and the B Corp mark. The guarantee is the proof most under-used against the durability and fit objections.",
    "source": {
      "type": "agent",
      "ref": "synthesis from merged brain records, 28 Sep 2026",
      "captured_at": "2026-09-28",
      "derived_from": [
        "bombas.claims.donation_pledge",
        "bombas.claims.guarantee_promise",
        "bombas.claims.ankle_socks_benefit"
      ]
    },
    "confidence": 0.8,
    "tier": "inferred",
    "status": "active",
    "visibility": "public",
    "added_by": "claude"
  },
  {
    "id": "bombas.positioning.reddit_frames",
    "brand": "bombas",
    "section": "positioning",
    "field": "reddit_frames",
    "value": {
      "buy_it_for_life": 9,
      "marketing_brand": 3,
      "worth_the_price": 2,
      "mission_giving": 1
    },
    "text": "On Reddit the category conversation is framed as buy it for life first. Bombas is discussed as a marketing-led brand more often than as a giving brand, and is rarely the brand recommended in durability threads.",
    "source": {
      "type": "agent",
      "ref": "synthesis from merged brain records, 28 Sep 2026",
      "captured_at": "2026-09-28",
      "derived_from": [
        "bombas.positioning.reddit_frame_buy_it_for_life",
        "bombas.positioning.reddit_frame_marketing_brand"
      ]
    },
    "confidence": 0.7,
    "tier": "inferred",
    "status": "active",
    "visibility": "private",
    "added_by": "claude"
  }
]
