[
  {
    "id": "example.offers.free_shipping_threshold_usd",
    "brand": "example",
    "section": "offers",
    "field": "free_shipping_threshold_usd",
    "value": 50,
    "text": "Free shipping on orders over $50.",
    "source": {"type": "site", "ref": "https://example.com/pages/shipping", "captured_at": "2026-09-28"},
    "confidence": 0.95,
    "tier": "site_backed",
    "status": "active",
    "visibility": "public",
    "valid_from": "2026-09-28",
    "expires_at": "2026-09-29",
    "evidence": [{"quote": "Free shipping on orders over $50", "ref": "https://example.com/pages/shipping"}],
    "history": []
  },
  {
    "id": "example.offers.guarantee",
    "brand": "example",
    "section": "offers",
    "field": "guarantee",
    "value": "100 percent happiness guarantee, any reason, any time",
    "text": "The brand offers a happiness guarantee: any reason, any time.",
    "source": {"type": "site", "ref": "https://example.com/pages/guarantee", "captured_at": "2026-09-28"},
    "confidence": 0.9,
    "tier": "site_backed",
    "status": "active",
    "visibility": "public",
    "expires_at": "2026-09-29"
  },
  {
    "id": "example.offers.current_promos",
    "brand": "example",
    "section": "offers",
    "field": "current_promos",
    "value": [{"name": "Buy 4 get 1 free packs", "starts": "2026-09-20", "ends": null}],
    "text": "One promo is running: buy 4 get 1 free on packs.",
    "source": {"type": "site", "ref": "https://example.com/collections/packs", "captured_at": "2026-09-28"},
    "confidence": 0.8,
    "tier": "site_backed",
    "status": "active",
    "visibility": "public",
    "expires_at": "2026-09-29"
  }
]
